{
  "id": "nangua-zheng-paigu",
  "name": "南瓜蒸排骨",
  "course": [
    "meat",
    "veg"
  ],
  "cuisine": "粤",
  "tags": [
    "一锅出"
  ],
  "minutes": 50,
  "difficulty": 1,
  "servings": 2,
  "ingredients": [
    {
      "id": "pork_rib",
      "qty": 300,
      "unit": "克",
      "main": true
    },
    {
      "id": "pumpkin",
      "qty": 300,
      "unit": "克",
      "main": true
    },
    {
      "id": "ginger",
      "qty": 2,
      "unit": "片"
    }
  ],
  "seasonings": [
    {
      "id": "soy_light",
      "qty": "1大勺"
    },
    {
      "id": "oyster",
      "qty": "1小勺"
    },
    {
      "id": "starch",
      "qty": "1小勺"
    },
    {
      "id": "oil",
      "qty": "1小勺"
    }
  ],
  "steps": [
    {
      "text": "排骨切小块，冲净血水擦干；南瓜去皮切块；姜切丝。",
      "method": "cut",
      "heat": "off"
    },
    {
      "text": "排骨加生抽、蚝油、淀粉、油和姜丝拌匀，腌15分钟。",
      "method": "marinate",
      "heat": "off",
      "timer": 900
    },
    {
      "text": "南瓜块铺在盘底，排骨铺在上面。",
      "method": "mix",
      "heat": "off"
    },
    {
      "text": "水开后大火蒸30分钟，筷子能扎透排骨即熟。",
      "method": "steam",
      "heat": "high",
      "timer": 1800
    }
  ],
  "dish": {
    "vessel": "plate",
    "sauce": null,
    "layers": [
      "pork_rib__steamed_black_bean",
      "potato__chunks_braised"
    ],
    "hero": true,
    "garnish": [
      "scallion"
    ]
  },
  "source": "curated",
  "author": "",
  "version": 1
}
