{
 "id": "yangcong-chao-youyu",
 "name": "洋葱炒鱿鱼",
 "course": [
  "meat"
 ],
 "cuisine": "家常",
 "tags": [
  "适合新手"
 ],
 "minutes": 25,
 "difficulty": 1,
 "servings": 2,
 "ingredients": [
  {
   "id": "squid",
   "qty": 250,
   "unit": "克",
   "main": true
  },
  {
   "id": "onion",
   "qty": 150,
   "unit": "克",
   "main": true
  },
  {
   "id": "ginger",
   "qty": 2,
   "unit": "片"
  }
 ],
 "seasonings": [
  {
   "id": "oil",
   "qty": "2小勺"
  },
  {
   "id": "soy_light",
   "qty": "1小勺"
  },
  {
   "id": "water",
   "qty": "30毫升"
  }
 ],
 "steps": [
  {
   "text": "洋葱洗净切片，姜切丝；生熟刀板分开。",
   "method": "cut",
   "heat": "off"
  },
  {
   "text": "鱿鱼去内脏、软骨和眼嘴，切段；处理后洗手洗具。",
   "method": "cut",
   "heat": "off"
  },
  {
   "text": "锅加油炒香姜丝，放鱿鱼翻炒。",
   "method": "stir_fry",
   "heat": "mid",
   "timer": 120
  },
  {
   "text": "加入洋葱、水和生抽，翻炒至配菜熟透。",
   "method": "stir_fry",
   "heat": "mid",
   "timer": 180
  },
  {
   "text": "鱿鱼肉不透明、扎实且最厚处达63℃，不足继续加热。",
   "method": "stir_fry",
   "heat": "mid"
  }
 ],
 "dish": {
  "vessel": "plate",
  "sauce": "clear",
  "layers": [
   "onion__slices"
  ],
  "garnish": [
   "ginger_shred"
  ],
  "hero": true
 },
 "source": "curated",
 "author": "Codex（待厨房验收）",
 "version": 1
}
