{
 "id": "xianggu-shao-baoyu",
 "name": "香菇焖鲍鱼",
 "course": [
  "meat"
 ],
 "cuisine": "家常",
 "tags": [
  "适合新手"
 ],
 "minutes": 30,
 "difficulty": 1,
 "servings": 2,
 "ingredients": [
  {
   "id": "abalone",
   "qty": 250,
   "unit": "克",
   "main": true
  },
  {
   "id": "shiitake",
   "qty": 150,
   "unit": "克",
   "main": true
  },
  {
   "id": "ginger",
   "qty": 2,
   "unit": "片"
  }
 ],
 "seasonings": [
  {
   "id": "oil",
   "qty": "2小勺"
  },
  {
   "id": "water",
   "qty": "50毫升"
  },
  {
   "id": "soy_light",
   "qty": "1小勺"
  }
 ],
 "steps": [
  {
   "text": "香菇洗净切片，姜切丝；海鲜用独立生食刀板切片。",
   "method": "cut",
   "heat": "off"
  },
  {
   "text": "处理生海鲜后洗手并清洗刀板和接触台面。",
   "method": "cut",
   "heat": "off"
  },
  {
   "text": "热锅加1小勺油，放香菇和30毫升水煮至熟透，盛出。",
   "method": "stir_fry",
   "heat": "mid",
   "timer": 300
  },
  {
   "text": "加剩余油炒姜，放海鲜、20毫升水和生抽加盖煮熟。",
   "method": "boil",
   "heat": "mid",
   "timer": 300
  },
  {
   "text": "海鲜最厚处达63℃且不透明，放回配菜拌匀盛出。",
   "method": "mix",
   "heat": "off"
  }
 ],
 "dish": {
  "vessel": "plate",
  "sauce": "clear",
  "layers": [
   "shiitake__braised"
  ],
  "garnish": [
   "ginger_shred"
  ],
  "hero": true
 },
 "source": "curated",
 "author": "Codex（待厨房验收）",
 "version": 1
}
