{
 "id": "tangcu-yu",
 "name": "糖醋鱼",
 "course": [
  "meat"
 ],
 "cuisine": "家常",
 "tags": [
  "下饭"
 ],
 "minutes": 35,
 "difficulty": 2,
 "servings": 2,
 "ingredients": [
  {
   "id": "fish_whole",
   "qty": 1,
   "unit": "条",
   "main": true,
   "note": "约500克"
  },
  {
   "id": "ginger",
   "qty": 5,
   "unit": "片"
  },
  {
   "id": "scallion",
   "qty": 1,
   "unit": "根"
  }
 ],
 "seasonings": [
  {
   "id": "oil",
   "qty": "1大勺"
  },
  {
   "id": "vinegar",
   "qty": "1大勺"
  },
  {
   "id": "sugar",
   "qty": "2小勺"
  },
  {
   "id": "soy_light",
   "qty": "1小勺"
  },
  {
   "id": "water",
   "qty": "100毫升"
  }
 ],
 "steps": [
  {
   "text": "鱼处理干净擦干，两面划刀；姜切丝，葱切段。",
   "method": "cut",
   "heat": "off"
  },
  {
   "text": "锅加油，中火把鱼煎到两面金黄定型。",
   "method": "fry",
   "heat": "mid",
   "timer": 360,
   "tip": "锅和油都热了再下鱼"
  },
  {
   "text": "加姜、水、生抽、醋和糖，煮开后转小火。",
   "method": "braise",
   "heat": "mid"
  },
  {
   "text": "盖盖焖8分钟，筷子能扎进鱼背最厚处即熟。",
   "method": "braise",
   "heat": "low",
   "timer": 480
  },
  {
   "text": "撒葱段，大火收汁，关火盛出。",
   "method": "braise",
   "heat": "high",
   "timer": 60
  }
 ],
 "dish": {
  "vessel": "oval",
  "sauce": "braise",
  "layers": [
   "fish_whole__braised"
  ],
  "garnish": [
   "ginger_shred",
   "scallion"
  ],
  "hero": false
 },
 "source": "curated",
 "author": "Codex（待厨房验收）",
 "version": 2
}
