{
 "id": "baizhuo-xia",
 "name": "白灼虾",
 "course": [
  "meat"
 ],
 "cuisine": "粤",
 "tags": [
  "快手",
  "清淡"
 ],
 "minutes": 15,
 "difficulty": 1,
 "servings": 2,
 "ingredients": [
  {
   "id": "shrimp",
   "qty": 400,
   "unit": "克",
   "main": true
  },
  {
   "id": "ginger",
   "qty": 1,
   "unit": "块"
  },
  {
   "id": "scallion",
   "qty": 2,
   "unit": "根"
  }
 ],
 "seasonings": [
  {
   "id": "water",
   "qty": "1500毫升"
  },
  {
   "id": "cooking_wine",
   "qty": "1大勺"
  },
  {
   "id": "salt",
   "qty": "适量"
  }
 ],
 "steps": [
  {
   "text": "虾剪去长须并挑出虾线，沥干；姜切片，葱打结。",
   "method": "cut",
   "heat": "off"
  },
  {
   "text": "锅内加1500毫升水、姜葱、料酒和盐，烧开。",
   "method": "boil",
   "heat": "high"
  },
  {
   "text": "倒入虾，水再开后煮1分钟。",
   "method": "boil",
   "heat": "high",
   "timer": 60
  },
  {
   "text": "虾身全红、弯成C形就捞出，沥干装盘。",
   "method": "boil",
   "heat": "off",
   "tip": "煮久了虾肉会老"
  }
 ],
 "dish": {
  "vessel": "plate",
  "sauce": null,
  "layers": [
   "shrimp__boiled"
  ],
  "garnish": [],
  "hero": true
 },
 "source": "curated",
 "author": "Codex（待厨房验收）",
 "version": 2
}
