{
 "id": "donggua-paigu-tang",
 "name": "冬瓜排骨汤",
 "course": [
  "soup"
 ],
 "cuisine": "粤",
 "tags": [
  "清淡"
 ],
 "minutes": 75,
 "difficulty": 2,
 "servings": 3,
 "ingredients": [
  {
   "id": "pork_rib",
   "qty": 400,
   "unit": "克",
   "main": true
  },
  {
   "id": "winter_melon",
   "qty": 500,
   "unit": "克",
   "main": true
  },
  {
   "id": "ginger",
   "qty": 1,
   "unit": "块"
  }
 ],
 "seasonings": [
  {
   "id": "water",
   "qty": "1800毫升"
  },
  {
   "id": "cooking_wine",
   "qty": "1大勺"
  },
  {
   "id": "salt",
   "qty": "适量"
  }
 ],
 "steps": [
  {
   "text": "排骨切3厘米块，冬瓜去皮去籽切块，姜切片。",
   "method": "cut",
   "heat": "off"
  },
  {
   "text": "排骨冷水下锅，煮开3分钟，捞出冲净浮沫。",
   "method": "blanch",
   "heat": "high",
   "timer": 180
  },
  {
   "text": "汤锅加1800毫升水、排骨、姜、料酒，烧开。",
   "method": "boil",
   "heat": "high"
  },
  {
   "text": "转小火盖盖煮45分钟。",
   "method": "stew",
   "heat": "low",
   "timer": 2700
  },
  {
   "text": "加入冬瓜，再煮15分钟，至冬瓜和排骨都熟软。",
   "method": "stew",
   "heat": "low",
   "timer": 900
  },
  {
   "text": "加盐调味，关火后盛出。",
   "method": "mix",
   "heat": "off"
  }
 ],
 "dish": {
  "vessel": "bowl",
  "sauce": "clear_soup",
  "layers": [
   "pork_rib__soup",
   "winter_melon__soup_chunks"
  ],
  "garnish": [],
  "hero": false
 },
 "source": "curated",
 "author": "Codex（待厨房验收）",
 "version": 1
}
