{
 "id": "yumi-huluobo-paigu-tang",
 "name": "玉米胡萝卜排骨汤",
 "course": [
  "soup"
 ],
 "cuisine": "粤",
 "tags": [
  "清淡"
 ],
 "minutes": 90,
 "difficulty": 1,
 "servings": 3,
 "ingredients": [
  {
   "id": "pork_rib",
   "qty": 400,
   "unit": "克",
   "main": true
  },
  {
   "id": "corn",
   "qty": 1,
   "unit": "根"
  },
  {
   "id": "carrot",
   "qty": 1,
   "unit": "根"
  },
  {
   "id": "ginger",
   "qty": 2,
   "unit": "片"
  }
 ],
 "seasonings": [
  {
   "id": "salt",
   "qty": "适量"
  },
  {
   "id": "water",
   "qty": "1500毫升"
  }
 ],
 "steps": [
  {
   "text": "排骨切块，玉米切段，胡萝卜切滚刀块，姜切片。",
   "method": "cut",
   "heat": "off"
  },
  {
   "text": "排骨冷水下锅，煮开后再煮3分钟，捞出洗净。",
   "method": "blanch",
   "heat": "high",
   "timer": 180
  },
  {
   "text": "汤锅加1500毫升水、姜和排骨，煮开后小火炖40分钟。",
   "method": "stew",
   "heat": "low",
   "timer": 2400
  },
  {
   "text": "加入玉米和胡萝卜再炖30分钟。",
   "method": "stew",
   "heat": "low",
   "timer": 1800
  },
  {
   "text": "加盐调味，盛出。",
   "method": "stew",
   "heat": "off",
   "tip": "盐最后放，肉不柴"
  }
 ],
 "dish": {
  "vessel": "bowl",
  "sauce": "clear_soup",
  "layers": [
   "pork_rib__soup",
   "carrot__slices"
  ],
  "hero": false,
  "garnish": [
   "scallion"
  ]
 },
 "source": "curated",
 "author": "",
 "version": 1
}
