{
 "id": "qingjiao-doufu",
 "name": "青椒炒豆腐",
 "course": [
  "veg"
 ],
 "cuisine": "家常",
 "tags": [
  "适合新手"
 ],
 "minutes": 25,
 "difficulty": 1,
 "servings": 2,
 "ingredients": [
  {
   "id": "tofu",
   "qty": 300,
   "unit": "克",
   "main": true
  },
  {
   "id": "green_pepper",
   "qty": 1,
   "unit": "个",
   "main": true
  },
  {
   "id": "garlic",
   "qty": 2,
   "unit": "瓣"
  }
 ],
 "seasonings": [
  {
   "id": "oil",
   "qty": "2小勺"
  },
  {
   "id": "soy_light",
   "qty": "1小勺"
  },
  {
   "id": "water",
   "qty": "50毫升"
  }
 ],
 "steps": [
  {
   "text": "豆腐切厚片，青椒去籽切块，蒜切末。",
   "method": "cut",
   "heat": "off"
  },
  {
   "text": "锅放1小勺油，中火煎豆腐两面定型。",
   "method": "fry",
   "heat": "mid",
   "timer": 360
  },
  {
   "text": "另加1小勺油炒蒜和青椒，加水煮至断生。",
   "method": "stir_fry",
   "heat": "mid",
   "timer": 180
  },
  {
   "text": "倒回豆腐和生抽，轻推煮匀后出锅。",
   "method": "braise",
   "heat": "mid",
   "timer": 120
  }
 ],
 "dish": {
  "vessel": "plate",
  "sauce": null,
  "layers": [
   "tofu__pan_fried",
   "green_pepper__strips"
  ],
  "garnish": [],
  "hero": false
 },
 "source": "curated",
 "author": "Codex（待厨房验收）",
 "version": 1
}
