{
 "id": "heijiao-jianyu",
 "name": "煎鱼配洋葱",
 "course": [
  "meat"
 ],
 "cuisine": "家常",
 "tags": [
  "适合新手"
 ],
 "minutes": 30,
 "difficulty": 2,
 "servings": 2,
 "ingredients": [
  {
   "id": "fish_whole",
   "qty": 1,
   "unit": "条",
   "main": true,
   "note": "约500克"
  },
  {
   "id": "onion",
   "qty": 100,
   "unit": "克",
   "main": true
  },
  {
   "id": "ginger",
   "qty": 3,
   "unit": "片"
  }
 ],
 "seasonings": [
  {
   "id": "oil",
   "qty": "1大勺"
  },
  {
   "id": "soy_light",
   "qty": "1小勺"
  },
  {
   "id": "water",
   "qty": "50毫升"
  }
 ],
 "steps": [
  {
   "text": "洋葱切丝、姜切片；另用刀板处理鱼并擦干，洗手洗具。",
   "method": "cut",
   "heat": "off"
  },
  {
   "text": "锅加油，中火煎鱼至两面金黄定型。",
   "method": "fry",
   "heat": "mid",
   "timer": 360
  },
  {
   "text": "放姜和洋葱炒香，加入生抽和水。",
   "method": "braise",
   "heat": "mid",
   "timer": 90
  },
  {
   "text": "盖盖小火焖，鱼肉最厚处中心达63℃。",
   "method": "braise",
   "heat": "low",
   "timer": 420
  }
 ],
 "dish": {
  "vessel": "oval",
  "sauce": "braise",
  "layers": [
   "fish_whole__braised",
   "onion__slices"
  ],
  "garnish": [],
  "hero": false
 },
 "source": "curated",
 "author": "Codex（待厨房验收）",
 "version": 1
}
