{
 "id": "xilanhua-chao-sanwenyu",
 "name": "西兰花炒三文鱼",
 "course": [
  "meat"
 ],
 "cuisine": "家常",
 "tags": [
  "适合新手"
 ],
 "minutes": 30,
 "difficulty": 1,
 "servings": 2,
 "ingredients": [
  {
   "id": "salmon",
   "qty": 250,
   "unit": "克",
   "main": true
  },
  {
   "id": "broccoli",
   "qty": 200,
   "unit": "克",
   "main": true
  },
  {
   "id": "ginger",
   "qty": 2,
   "unit": "片"
  }
 ],
 "seasonings": [
  {
   "id": "oil",
   "qty": "2小勺"
  },
  {
   "id": "water",
   "qty": "50毫升"
  },
  {
   "id": "soy_light",
   "qty": "1小勺"
  }
 ],
 "steps": [
  {
   "text": "西兰花切小朵，姜切丝；海鲜用独立生食刀板切片。",
   "method": "cut",
   "heat": "off"
  },
  {
   "text": "处理生海鲜后洗手并清洗刀板和接触台面。",
   "method": "cut",
   "heat": "off"
  },
  {
   "text": "热锅加1小勺油，放西兰花和30毫升水煮至熟透，盛出。",
   "method": "stir_fry",
   "heat": "mid",
   "timer": 240
  },
  {
   "text": "加剩余油炒姜，放海鲜、20毫升水和生抽加盖煮熟。",
   "method": "boil",
   "heat": "mid",
   "timer": 300
  },
  {
   "text": "海鲜最厚处达63℃且不透明，放回配菜拌匀盛出。",
   "method": "mix",
   "heat": "off"
  }
 ],
 "dish": {
  "vessel": "plate",
  "sauce": "clear",
  "layers": [
   "broccoli__florets"
  ],
  "garnish": [
   "ginger_shred"
  ],
  "hero": true
 },
 "source": "curated",
 "author": "Codex（待厨房验收）",
 "version": 1
}
