{
 "id": "donggua-ji-tang",
 "name": "冬瓜鸡腿汤",
 "course": [
  "soup"
 ],
 "cuisine": "家常",
 "tags": [
  "适合新手"
 ],
 "minutes": 50,
 "difficulty": 2,
 "servings": 2,
 "ingredients": [
  {
   "id": "chicken_thigh",
   "qty": 350,
   "unit": "克",
   "main": true
  },
  {
   "id": "winter_melon",
   "qty": 300,
   "unit": "克",
   "main": true
  },
  {
   "id": "ginger",
   "qty": 3,
   "unit": "片"
  }
 ],
 "seasonings": [
  {
   "id": "water",
   "qty": "1000毫升"
  },
  {
   "id": "salt",
   "qty": "1克"
  }
 ],
 "steps": [
  {
   "text": "冬瓜去皮切块，姜切片；另用刀板切鸡块并洗手洗具。",
   "method": "cut",
   "heat": "off"
  },
  {
   "text": "鸡块加水和姜煮开，撇去浮沫。",
   "method": "boil",
   "heat": "high"
  },
  {
   "text": "转小火煮20分钟。",
   "method": "stew",
   "heat": "low",
   "timer": 1200
  },
  {
   "text": "加入冬瓜，再煮10分钟至冬瓜软。",
   "method": "stew",
   "heat": "low",
   "timer": 600
  },
  {
   "text": "冬瓜软且鸡肉最厚处中心达74℃后加盐。",
   "method": "stew",
   "heat": "low"
  }
 ],
 "dish": {
  "vessel": "bowl",
  "sauce": "clear_soup",
  "layers": [
   "chicken_thigh__pieces_braised",
   "winter_melon__soup_chunks"
  ],
  "garnish": [],
  "hero": false
 },
 "source": "curated",
 "author": "Codex（待厨房验收）",
 "version": 1
}
